id,no,tanggal_aduan,judul_klaim,aduanpantauan,jenis_materi,topik,sub_topik,lokasi,sub_lokasi,jenis_dismis_informasi,sumber_hoaks,kanal_aduan,media_rujukan
1,1,01/01/2022,DITEMUKAN HARIMAU JAWA DI JALUR CISAGA-RANCAH CIAMIS,ADUAN,VIDEO,FENOMENA,MAKHLUK HIDUP,JAWA BARAT,KABUPATEN CIAMIS,FALSE CONTEXT,YOUTUBE,INSTAGRAM,HARAPANRAKYAT
2,2,03/01/2022,GAGAL JANTUNG HINGGA STROK ADALAH GEJALA OMICRON,PANTAUAN,TEXT,KESEHATAN,CORONA,NASIONAL,NASIONAL,MISLEADING CONTENT,WHATSAPP,WHATSAPP,"ANTARANEWS, KOMINFO, PIKIRANRAKYAT"
3,3,03/01/2022,DIREKTUR JENDRAL WHO MEMPERINGATKAN MEMBERIKAN VAKSIN BOOSTER COVID-19 DAPAT MEMBUNUH ANAK-ANAK,PANTAUAN,VIDEO,KESEHATAN,CORONA - VAKSIN,INTERNATIONAL,INTERNATIONAL,FALSE CONTEXT,TWITTER,FACEBOOK,"AFP, KOMINFO"
4,4,03/01/2022,DAFTAR PERAWATAN UNTUK MEMBERSIHKAN TUBUH SETELAH VAKSINASI COVID-19,PANTAUAN,TEXT,KESEHATAN,CORONA - VAKSIN,INTERNATIONAL,INTERNATIONAL,MISLEADING CONTENT,FACEBOOK,FACEBOOK,"AFP, KOMINFO"
5,5,03/01/2022,HANAMASA TIDAK HALAL,ADUAN,LINK,PANGAN,MAKANAN,NASIONAL,NASIONAL,BENAR,INSTAGRAM,INSTAGRAM,JAWAPOS
6,6,03/01/2022,"WASPADA PENCULIKAN ANAK DENGAN MODUS PENJUAL, OM TELOLET, ORANG GILA, IBU HAMIL, PENGEMIS",ADUAN,GAMBAR,KRIMINALITAS,PENCULIKAN,NASIONAL,NASIONAL,FABRICATED CONTENT,WHATSAPP,WHATSAPP,0
7,7,03/01/2022,LOWONGAN KERJA PLAZA ASIA SUMEDANG DENGAN SYARAT VIDEO CALL SEX,PANTAUAN,TEXT,KRIMINALITAS,PENIPUAN,JAWA BARAT,KABUPATEN SUMEDANG,FABRICATED CONTENT,FACEBOOK,WEBSITE,"DETIK, KOMINFO, RUBERID"
8,8,04/01/2022,SPERMA PRIA YANG TAK DIVAKSIN BERHARGA DI MASA DEPAN,PANTAUAN,GAMBAR,KESEHATAN,CORONA - VAKSIN,NASIONAL,NASIONAL,FALSE CONTEXT,FACEBOOK,WEBSITE,"MAKASSARTERKINIID, KOMINFO"
9,9,05/01/2022,EDARAN KENAIKAN HARGA LPG YANG MENGATASNAMAKAN PERTAMINA,ADUAN,GAMBAR,EKONOMI,EKONOMI,NASIONAL,NASIONAL,BENAR,FACEBOOK,INSTAGRAM,0
10,10,05/01/2022,BUMI AKAN MENGALAMI FENOMENA APHELION,ADUAN,TEXT,FENOMENA,ALAM,NASIONAL,NASIONAL,MISLEADING CONTENT,FACEBOOK,INSTAGRAM,"KOMINFO, KOMPAS, LIPUTAN6"
11,11,06/01/2022,GULA MERAH LEBIH SEHAT KETIMBANG GULA PUTIH,ADUAN,TEXT,KESEHATAN,KESEHATAN,NASIONAL,NASIONAL,MISLEADING CONTENT,WHATSAPP,WHATSAPP,"LIPUTAN6, KLIKDOKTER"
12,12,06/01/2022,EDARAN KENAIKAN HARGA LPG YANG MENGATASNAMAKAN PERTAMINA,ADUAN,GAMBAR,EKONOMI,EKONOMI,NASIONAL,NASIONAL,BENAR,FACEBOOK,INSTAGRAM,"KOMPAS, EKONOMIBISNIS, LIPUTAN6"
13,13,06/01/2022,SELAMAT NOMOR ANDA MENDAPATKAN HADIAH CEK 155JUTA DARI GIVEAWAY TIK TOK 2021,ADUAN,TEXT,KRIMINALITAS,PENIPUAN,NASIONAL,NASIONAL,FABRICATED CONTENT,WHATSAPP,WHATSAPP,https://bit.ly/31wRceK
14,14,07/01/2022,PERAYAAN HUT PERTAMINA KE-55 MELALUI KUISIONER ANDA AKAN MEMILIKI KESEMPATAN UNTUK MENDAPATKAN RP 2.000.000,ADUAN,LINK,HUKUM DAN REGULASI,HUKUM DAN REGULASI,NASIONAL,NASIONAL,FABRICATED CONTENT,WHATSAPP,WHATSAPP,https://bit.ly/3qTHf3K
15,15,08/01/2022,"RI JOR-JORAN IMPOR CABAI: DARI CHINA, INDIA, SAMPAI SPANYOL!",ADUAN,LINK,EKONOMI,EKONOMI,NASIONAL,NASIONAL,BENAR,FACEBOOK,INSTAGRAM,CNBC
16,16,08/01/2022,AKUN WHATSAPP MENGATASNAMAKAN KAPOLDA JAWA BARAT AHMAD DOFIRI,ADUAN,LINK,KRIMINALITAS,PENIPUAN,JAWA BARAT,KOTA BANDUNG,IMPOSTER CONTENT,WHATSAPP,WHATSAPP,0
17,17,09/01/2022,"DENDA BAGI YANG MEMBERIKAN UANG KE ANAK JALANAN, PENGEMIS, GELANDANGAN",ADUAN,GAMBAR,HUKUM DAN REGULASI,HUKUM DAN REGULASI,NASIONAL,NASIONAL,BENAR,FACEBOOK,INSTAGRAM,"MAKASSARTERKINI, BPK"
18,18,09/01/2022,UST YUSUF MANSYUR DITANGKAP POLISI,ADUAN,VIDEO,HUKUM DAN REGULASI,HUKUM DAN REGULASI,NASIONAL,NASIONAL,FALSE CONNECTION,FACEBOOK,INSTAGRAM,"Tempo, Liputan6"
19,19,09/01/2022,LINK HADIAH RP 2 JUTA ULANG TAHUN KE 55 PERTAMINA,ADUAN,LINK,KRIMINALITAS,PENIPUAN,NASIONAL,NASIONAL,FABRICATED CONTENT,WEBSITE,INSTAGRAM,"KOMINFO, KOMPAS"
20,20,09/01/2022,LINK HADIAH RP 2 JUTA ULANG TAHUN KE 55 PERTAMINA,ADUAN,LINK,KRIMINALITAS,PENIPUAN,NASIONAL,NASIONAL,FABRICATED CONTENT,WEBSITE,INSTAGRAM,0
21,21,10/01/2022,LINK HADIAH RP 2 JUTA ULANG TAHUN KE 55 PERTAMINA,ADUAN,LINK,KRIMINALITAS,PENIPUAN,NASIONAL,NASIONAL,FABRICATED CONTENT,WEBSITE,WHATSAPP,0
22,22,10/01/2022,POLRES CIMAHI MERILIS FOTO PELAKU TINDAK PIDANA PEMBUNUHAN DI WILAYAH CIMAHI,ADUAN,GAMBAR,KRIMINALITAS,PEMBUNUHAN,JAWA BARAT,KOTA CIMAHI,BENAR,WHATSAPP,INSTAGRAM,MEDIAINDONESIA
23,23,10/01/2022,LOWONGAN KERJA TERKINI PT. ASTRA (GROUP),ADUAN,TEXT,KRIMINALITAS,PENIPUAN,NASIONAL,NASIONAL,FABRICATED CONTENT,WHATSAPP,WHATSAPP,.
24,24,11/01/2022,PLN PADAMKAN LISTRIK MULAI JANUARI 2022 AKIBAT KRISIS BATU BARA,PANTAUAN,GAMBAR,HUKUM DAN REGULASI,HUKUM DAN REGULASI,NASIONAL,NASIONAL,FABRICATED CONTENT,FACEBOOK,FACEBOOK,"LIPUTAN6, PLN"
25,25,11/01/2022,"DAFTAR PENERIMA BLT UMKM RP1,2 JUTA PADA JANUARI",PANTAUAN,GAMBAR,KRIMINALITAS,PENIPUAN,NASIONAL,NASIONAL,FABRICATED CONTENT,FACEBOOK,FACEBOOK,"ANTARA, KOMPAS, KONTAN, KOMINFO"
26,26,11/01/2022,VIDEO PELAKU PENCULIKAN ANAK YANG TERJADI DI SINDANG BARANG,PANTAUAN,VIDEO,KRIMINALITAS,PENCULIKAN,JAWA BARAT,KABUPATEN CIANJUR,FALSE CONTEXT,WHATSAPP,WHATSAPP,"DETIK, TEMPO,"
27,27,11/01/2022,MUNCUL VARIAN BARU COVID-19 BERNAMA FLORONA,PANTAUAN,LINK,KESEHATAN,CORONA,NASIONAL,NASIONAL,FALSE CONTEXT,FACEBOOK,FACEBOOK,"MEDCOM, KOMPAS"
28,28,11/01/2022,PENERIMA VAKSIN COVID-19 LEBIH MUDAH TERINFEKSI OMICRON DIBANDINGKAN NONVAKSIN,PANTAUAN,TEXT,KESEHATAN,CORONA - VAKSIN,INTERNATIONAL,INTERNATIONAL,FALSE CONTEXT,TWITTER,TWITTER,"KOMINFO, ANTARA"
29,29,11/01/2022,AKAN BEREDAR VIDEO SOAL COVID-19 INDIA YANG RETAS PONSEL DALAM 10 DETIK,PANTAUAN,TEXT,KRIMINALITAS,PENIPUAN,NASIONAL,NASIONAL,FABRICATED CONTENT,WHATSAPP,WHATSAPP,"SNOPE, THEQUINT, LIPUTAN6, MEDCOM"
30,30,12/01/2022,SURAT PEMBERITAHUAN AGENDA STUDY TOUR KE YOGYAKARTA DARI UNISBA,PANTAUAN,TEXT,PENDIDIKAN,PENDIDIKAN,JAWA BARAT,KOTA BANDUNG,FABRICATED CONTENT,WHATSAPP,WHATSAPP,UNISBA
31,31,12/01/2022,PERNYATAAN GUBERNUR DIY SRI SULTAN HB X SOAL COVID-19,ADUAN,LINK,FIGUR,CORONA,NASIONAL,NASIONAL,MANIPULATED CONTENT,WEBSITE,WHATSAPP,0
32,32,13/01/2022,AKSES AKUN FACEBOOK GUNAKAN BUKTI VAKSINASI COVID-19,PANTAUAN,GAMBAR,TEKNOLOGI,TEKNOLOGI,INTERNATIONAL,INTERNATIONAL,FABRICATED CONTENT,FACEBOOK,FACEBOOK,"KOMINFO, LIPUTAN6, REUTERS"
33,33,13/01/2022,AKUN WHATSAPP MENGATASNAMAKAN KAPOLDA JAWA BARAT AHMAD DOFIRI,ADUAN,LINK,KRIMINALITAS,PENIPUAN,JAWA BARAT,KOTA BANDUNG,IMPOSTER CONTENT,WHATSAPP,WHATSAPP,0
34,34,13/01/2022,KEMENKES UNGKAP KASUS OMICRON KEBANYAKAN DARI ORANG YANG DIVAKSINASI LENGKAP,ADUAN,LINK,KESEHATAN,CORONA,NASIONAL,NASIONAL,BENAR,WHATSAPP,INSTAGRAM,PIKIRANRAKYAT
35,35,13/01/2022,VIDEO : MINUM AIR PUTIH KETIKA TELP DI HP YANG SEDANG DI CHARGE AKAN MENGALIRKAN LISTRIK KEJANTUNG,ADUAN,VIDEO,KESEHATAN,KESEHATAN,INTERNATIONAL,INTERNATIONAL,MISLEADING CONTENT,WHATSAPP,WHATSAPP,"THEQUINT, AFP, JALAHOAKS"
36,36,14/01/2022,PRESIDEN JOKOWI BELI 2 KAPAL PERANG TNI AL UNTUK BAYAR UTANG,ADUAN,LINK,PERTAHANAN,PERTAHANAN,NASIONAL,NASIONAL,FALSE CONNECTION,WHATSAPP,WHATSAPP,"GELORA, SINDONEWS, KATADATA"
37,37,14/01/2022,VARIAN BARU COVID-19 ANTARA IHU DAN OMICRON : ANALISIS DRH. INDRO CAHYONO (AHLI VIRUS),ADUAN,LINK,KESEHATAN,CORONA,NASIONAL,NASIONAL,BENAR,YOUTUBE,WHATSAPP,JPNN
38,38,15/01/2022,VIDEO LONGSOR DI CIHERANG SUMEDANG,ADUAN,VIDEO,BENCANA ALAM,TANAH LONGSOR,JAWA BARAT,KABUPATEN SUMEDANG,BENAR,WHATSAPP,INSTAGRAM,"BPBD SUMEDANG, BPBD JABAR"
39,39,16/01/2022,CERITA SESEORANG TERKURAS UANG DI REKENINGNYA SEBAB IA MENEKAN TOMBOL ANGKA 1 DI PONSELNYA SAAT MENERINA TELPON SOAL VAKSIN,ADUAN,TEXT,KRIMINALITAS,PENIPUAN,NASIONAL,NASIONAL,FABRICATED CONTENT,WHATSAPP,INSTAGRAM,SATGAS COVID-19
40,40,16/01/2022,AKUN WHATSAPP MENGATASNAMAKAN KAPOLDA JAWA BARAT AHMAD DOFIRI,ADUAN,LINK,KRIMINALITAS,PENIPUAN,JAWA BARAT,KOTA BANDUNG,IMPOSTER CONTENT,WHATSAPP,WHATSAPP,0
41,41,16/01/2022,REKRUTMEN  DISKOMINFO JABAR MEMINTA BIAYA,ADUAN,TEXT,KRIMINALITAS,PENIPUAN,JAWA BARAT,JAWA BARAT,IMPOSTER CONTENT,WHATSAPP,INSTAGRAM,0
42,42,17/01/2022,PESAN SUARA PERINGATAN GEMPA SUSULAN DAN TSUNAMI DI PALABUHAN RATU,PANTAUAN,AUDIO,BENCANA ALAM,TSUNAMI,JAWA BARAT,KABUPATEN SUKABUMI,FABRICATED CONTENT,WHATSAPP,WHATSAPP,"INSTAGRAMBMKGBANDUNG, CNNINDONESIA"
43,43,17/01/2022,PERMEN YUPI TERBUAT DARI KULIT BABI,PANTAUAN,VIDEO,PANGAN,PRODUK,NASIONAL,NASIONAL,FABRICATED CONTENT,TIKTOK,FACEBOOK,"MEDCOM, SUARA, TIMESINDONESIA"
44,44,17/01/2022,VIDEO PERISTIWA GEMPA DI BANTEN PADA 14 JANUARI 2022,ADUAN,VIDEO,BENCANA ALAM,GEMPA BUMI,NASIONAL,NASIONAL,FALSE CONTEXT,WHATSAPP,WHATSAPP,0
45,45,17/01/2022,POTENSI GEMPA 8.7M JAKARTA DAN SEKITARNYA DALAM BAHAYA,ADUAN,TEXT,BENCANA ALAM,GEMPA BUMI,NASIONAL,NASIONAL,BENAR,WHATSAPP,INSTAGRAM,BMKG
46,46,17/01/2022,VIDEO PERISTIWA GEMPA DI BANTEN PADA 14 JANUARI 2022,ADUAN,VIDEO,BENCANA ALAM,GEMPA BUMI,NASIONAL,NASIONAL,FALSE CONTEXT,WHATSAPP,WHATSAPP,"LIPUTAN6, JAREDSURYAPERMANA"
47,47,17/01/2022,PESAN MELALU WA AJAKAN UNTUK MENGISI LINK VAKSIN KE-3/BOOSTER DI RUMAH SAKIT JANGAN MAU KARENA ITU PENIPUAN,ADUAN,TEXT,KESEHATAN,CORONA - VAKSIN,NASIONAL,NASIONAL,BENAR,WHATSAPP,WHATSAPP,0
48,48,17/01/2022,VAKSIN BOOSTER BERBAYAR UNTUK MASYARAKAT YANG TIDAK PUNYA KARTU BPJS KESEHATAN,PANTAUAN,GAMBAR,KESEHATAN,CORONA - VAKSIN,NASIONAL,NASIONAL,MISLEADING CONTENT,FACEBOOK,FACEBOOK,"KOMPAS, TWITTERJOKOWI, KOMINFO"
49,49,17/01/2022,PESAN MELALU WA AJAKAN UNTUK MENGISI LINK VAKSIN KE-3/BOOSTER DI RUMAH SAKIT JANGAN MAU KARENA ITU PENIPUAN,ADUAN,TEXT,KESEHATAN,CORONA - VAKSIN,NASIONAL,NASIONAL,BENAR,WHATSAPP,WHATSAPP,0
50,50,17/01/2022,UNDANGAN RAPAT PENINGKATAN KINERJA TENAGA MEDIS OLEH KADIS DINKES KOTA BANDUNG PADA BULAN JANUARI 2022,PANTAUAN,TEXT,KRIMINALITAS,PENIPUAN,JAWA BARAT,KOTA BANDUNG,FABRICATED CONTENT,SMS,WHATSAPP,INSTAGRAMAHYANIRAKSANAGARA
51,51,17/01/2022,PESAN MELALU WA AJAKAN UNTUK MENGISI LINK VAKSIN KE-3/BOOSTER DI RUMAH SAKIT JANGAN MAU KARENA ITU PENIPUAN,ADUAN,TEXT,KESEHATAN,CORONA - VAKSIN,NASIONAL,NASIONAL,BENAR,WHATSAPP,WHATSAPP,DETIK
52,52,17/01/2022,KISAH KEHIDUPAN UPIN-IPIN DI DUNIA NYATA,PANTAUAN,VIDEO,ENTERTAIMENT,ENTERTAIMENT,NASIONAL,NASIONAL,FABRICATED CONTENT,TWITTER,FACEBOOK,"TWITTERLESCOPAQUE, INSTAGRAMUPINIPINOFFICIAL"
53,53,18/01/2022,YANG TIDAK PUNYA KARTU BPJS KESEHATAN WAJIB MEMBAYAR VAKSIN BOOSTER,PANTAUAN,GAMBAR,KESEHATAN,CORONA - VAKSIN,NASIONAL,NASIONAL,FALSE CONTEXT,FACEBOOK,FACEBOOK,MEDCOM
54,54,18/01/2022,PESAN SUARA AKAN ADA GEMPA SUSULAN BERPOTENSI TSUNAMI DI PALABUHANRATU SUKABUMI,PANTAUAN,TEXT,BENCANA ALAM,GEMPA BUMI,JAWA BARAT,KABUPATEN SUKABUMI,FABRICATED CONTENT,WHATSAPP,WHATSAPP,"Badan Meteorologi, Klimatologi, Dan Geofisika Stasiun Geofisika Bandung"
55,55,18/01/2022,VIDEO PELAKU PENCULIKAN ANAK BABAK BELUR DIAMUK MASSA DI BOGOR,PANTAUAN,VIDEO,KRIMINALITAS,PENCULIKAN,JAWA BARAT,KOTA BOGOR,FALSE CONTEXT,WHATSAPP,WHATSAPP,"MEDCOM, KOMINFO, TRIBUNNEWS"
56,56,18/01/2022,REKRUTMEN KARYAWAN PT BRI (PERSERO TBK),PANTAUAN,TEXT,KRIMINALITAS,PENIPUAN,NASIONAL,NASIONAL,FABRICATED CONTENT,EMAIL,EMAIL,BRI
57,57,18/01/2022,HARI INI GURU YANG HAMILI SANTRI AKAN DITEMBAK DALAM JARAK 5 METER TEPAT DI BAGIAN JANTUNG,PANTAUAN,TEXT,KRIMINALITAS,PEMERKOSAAN,JAWA BARAT,KOTA BANDUNG,FALSE CONNECTION,WEBSITE,FACEBOOK,"KOMINFO, TURNBACKHOAX"
58,58,18/01/2022,VIDEO WARGA TAK SADAR SAAT TSUNAMI DATANG,PANTAUAN,VIDEO,BENCANA ALAM,TSUNAMI,NASIONAL,NASIONAL,FALSE CONTEXT,FACEBOOK,FACEBOOK,"MEDCOM, TEMPO, LICETSTUDIOS"
59,59,18/01/2022,VIDEO PERISTIWA GEMPA DI BANTEN PADA 14 JANUARI 2022,PANTAUAN,VIDEO,BENCANA ALAM,GEMPA BUMI,NASIONAL,NASIONAL,FALSE CONTEXT,FACEBOOK,FACEBOOK,"LIPUTAN6, JAREDSURYAPERMANA"
60,60,19/01/2022,NOMOR ANDA MENDAPATKAN HADIAH CEK 75JUTA DARI  TIK TOK,ADUAN,TEXT,KRIMINALITAS,PENIPUAN,NASIONAL,NASIONAL,IMPOSTER CONTENT,WHATSAPP,WHATSAPP,"GADGETTREN, KOMINFO"
61,61,20/01/2022,PEMINDAHAN IBU KOTA KE KALTIM ADALAH PROGRAM PKI TAHUN 1955,ADUAN,VIDEO,HUKUM DAN REGULASI,HUKUM DAN REGULASI,NASIONAL,NASIONAL,FALSE CONTEXT,WHATSAPP,WHATSAPP,Medcom.id Kominfo
62,62,20/01/2022,REKRUTMEN  DISKOMINFO JABAR MEMINTA BIAYA,ADUAN,TEXT,KRIMINALITAS,PENIPUAN,JAWA BARAT,JAWA BARAT,IMPOSTER CONTENT,WHATSAPP,INSTAGRAM,0
63,63,20/01/2022,REKRUTMEN  DISKOMINFO JABAR MEMINTA BIAYA,ADUAN,TEXT,KRIMINALITAS,PENIPUAN,JAWA BARAT,JAWA BARAT,IMPOSTER CONTENT,WHATSAPP,INSTAGRAM,0
64,64,20/01/2022,VIDEO ANAK DISUNTIKKAN VAKSIN KOSONG,ADUAN,VIDEO,KESEHATAN,CORONA - VAKSIN,NASIONAL,NASIONAL,BENAR,LAINNYA,INSTAGRAM,DETIK
65,65,20/01/2022,VIDEO ANAK DISUNTIKKAN VAKSIN KOSONG,ADUAN,VIDEO,KESEHATAN,CORONA - VAKSIN,NASIONAL,NASIONAL,BENAR,LAINNYA,INSTAGRAM,0
66,66,21/01/2022,VIDEO ANAK DISUNTIKKAN VAKSIN KOSONG,ADUAN,VIDEO,KESEHATAN,CORONA - VAKSIN,NASIONAL,NASIONAL,BENAR,WHATSAPP,WHATSAPP,0
67,67,21/01/2022,SEORANG GURU NGAJI LUMPUH KARENA DIVAKSIN,PANTAUAN,TEXT,KESEHATAN,CORONA - VAKSIN,NASIONAL,NASIONAL,FABRICATED CONTENT,WHATSAPP,WHATSAPP,"INSTAGRAMKABARBANUAKALSEL, MEDCOM"
68,68,21/01/2022,METEOR AKAN JATUH DI INDONESIA PADA 7 MEI 2022,PANTAUAN,VIDEO,BENCANA ALAM,BENCANA ALAM,NASIONAL,NASIONAL,FALSE CONTEXT,TIKTOK,TIKTOK,"KOMPAS, MEDCOM"
69,69,21/01/2022,FOTO JALAN RUSAK DAN MASJID ROBOH KARENA GEMPA BANTEN 2022,PANTAUAN,GAMBAR,BENCANA ALAM,GEMPA BUMI,JAWA BARAT,KABUPATEN BOGOR,FALSE CONTEXT,WEBSITE,WEBSITE,"JAWAPOS, DETIK"
70,70,22/01/2022,BRIPDA RANDI BAGUS BELUM DIPECAT DARI KEPOLISIAN,ADUAN,TEXT,HUKUM DAN REGULASI,HUKUM DAN REGULASI,NASIONAL,NASIONAL,BENAR,INSTAGRAM,INSTAGRAM,"DETIK, CNNINDONESIA, BISNIS"
71,71,22/01/2022,SMS PEMBERITAHUAN PEMENANG UNDIAN KE-2 DARI PT SHOPEE SEBESAR RP 185 JUTA,ADUAN,TEXT,EKONOMI,PENIPUAN,NASIONAL,NASIONAL,FABRICATED CONTENT,WHATSAPP,WHATSAPP,0
72,72,22/01/2022,SMS PEMBERITAHUAN PEMENANG UNDIAN KE-2 DARI PT SHOPEE SEBESAR RP 185 JUTA,ADUAN,TEXT,EKONOMI,PENIPUAN,NASIONAL,NASIONAL,FABRICATED CONTENT,WHATSAPP,WHATSAPP,0
73,73,24/01/2022,MCDONALD'S DITUTUP 3 NEGARA KARENA MENGGUNAKAN DAGING MANUSIA,PANTAUAN,TEXT,PANGAN,MAKANAN,INTERNATIONAL,INTERNATIONAL,FABRICATED CONTENT,FACEBOOK,FACEBOOK,"USATODAY, MCDONALDS, MEDCOM"
74,74,24/01/2022,TUKUL ARWANA DIKABARKAN MENINGGAL DUNIA,PANTAUAN,VIDEO,FIGUR,FIGUR,NASIONAL,NASIONAL,FABRICATED CONTENT,YOUTUBE,YOUTUBE,"PIKIRANRAKYAT, MEDCOM"
75,75,24/01/2022,KACA INDOMARET PECAH DISERBU PEMBELI YANG BEREBUT MINYAK GORENG,PANTAUAN,GAMBAR,PANGAN,PRODUK,NASIONAL,NASIONAL,FALSE CONTEXT,FACEBOOK,FACEBOOK,"KOMPAS, KOMPAS"
76,76,24/01/2022,RAJA SALMAN MENINGGAL DUNIA,ADUAN,VIDEO,FIGUR,FIGUR,INTERNATIONAL,INTERNATIONAL,FABRICATED CONTENT,WHATSAPP,WHATSAPP,0
77,77,24/01/2022,RAJA SALMAN MENINGGAL DUNIA,PANTAUAN,VIDEO,FIGUR,FIGUR,INTERNATIONAL,INTERNATIONAL,FABRICATED CONTENT,YOUTUBE,YOUTUBE,"DETIK, CNBC, REPUBLIKA"
78,78,24/01/2022,BAGI-BAGI GIVEAWAY DARI BAIM WONG DI FACEBOOK,ADUAN,TEXT,KRIMINALITAS,FIGUR,NASIONAL,NASIONAL,IMPOSTER CONTENT,WHATSAPP,WHATSAPP,0
79,79,25/01/2022,SINGAPURA NEGARA PERTAMA DI DUNIA YANG LAKUKAN OTOPSI JENAZAH COVID-19,ADUAN,TEXT,KESEHATAN,CORONA,INTERNATIONAL,INTERNATIONAL,FABRICATED CONTENT,WHATSAPP,WHATSAPP,0
80,80,26/01/2022,SEJUMLAH ANGGOTA TUBUH PARA DEMONSTRAN DI ISRAEL KELUARKAN ASAP PUTIH KARENA TERTANAM NANO CHIP,PANTAUAN,GAMBAR,KESEHATAN,CORONA - VAKSIN,INTERNATIONAL,INTERNATIONAL,MISLEADING CONTENT,WHATSAPP,WHATSAPP,"MEDCOM, AFP"
81,81,26/01/2022,DANA SEBAR UANG HINGGA 1 JUTA UNTUK 300 ORANG DENGAN AKSES LINK INI,PANTAUAN,LINK,KRIMINALITAS,PENIPUAN,NASIONAL,NASIONAL,FABRICATED CONTENT,WHATSAPP,WHATSAPP,"MEDCOM, DANAINSTAGRAM"
82,82,26/01/2022,HASIL PENELITIAN SEBUT VAKSIN COVID-19 LEBIH BANYAK MENYEBABKAN PENYAKIT KETIMBANG MANFAATNYA,PANTAUAN,GAMBAR,KESEHATAN,CORONA - VAKSIN,INTERNATIONAL,INTERNATIONAL,FALSE CONTEXT,WEBSITE,TWITTER,"MEDCOM, POLITIFACT"
83,83,26/01/2022,"IBU KOTA NEGARA DIATAS LAHAN SENGKETA, KLAIM LAHAN IKN KERABAT KESULTANAN KUTAI TUNJUKAN BUKTI",ADUAN,TEXT,HUKUM DAN REGULASI,HUKUM DAN REGULASI,NASIONAL,NASIONAL,BENAR,WHATSAPP,WHATSAPP,CNBCINDONESIA
84,84,26/01/2022,SURAT TERBUKA BERISI KLAIM VAKSINASI MERUPAKAN PROGRAM GENOSIDA DAN MENYEBABKAN MANDUL,ADUAN,TEXT,KESEHATAN,CORONA - VAKSIN,NASIONAL,NASIONAL,MISLEADING CONTENT,WHATSAPP,WHATSAPP,TEMPO
85,85,26/01/2022,SURAT PANGGILAN INTERVIEW PT ANTAM,PANTAUAN,GAMBAR,KRIMINALITAS,PENIPUAN,NASIONAL,NASIONAL,FABRICATED CONTENT,WHATSAPP,WHATSAPP,"MEDCOM, ANTAMINSTAGRAM"
86,86,26/01/2022,SURAT PENGANGKATAN TENAGA HONORER JADI PNS TANPA TES,PANTAUAN,GAMBAR,KRIMINALITAS,PENIPUAN,NASIONAL,NASIONAL,IMPOSTER CONTENT,WHATSAPP,WHATSAPP,"MEDCOM, BKNGOIDOFFICIAL"
87,87,26/01/2022,"TENTARA CHINA NYAMAR JADI TUKANG GOJEK, NANGIS KARENA GA BISA PULANG KE TEMPAT PERSEMBUNYIANNYA",ADUAN,VIDEO,HUKUM DAN REGULASI,HUKUM DAN REGULASI,NASIONAL,NASIONAL,FALSE CONTEXT,WHATSAPP,WHATSAPP,medcom.id suara.com
88,88,27/01/2022,"TENTARA CHINA NYAMAR JADI TUKANG GOJEK, NANGIS KARENA GA BISA PULANG KE TEMPAT PERSEMBUNYIANNYA",ADUAN,VIDEO,HUKUM DAN REGULASI,HUKUM DAN REGULASI,NASIONAL,NASIONAL,FALSE CONTEXT,WHATSAPP,WHATSAPP,0
89,89,27/01/2022,PERMEN NARKOBA BARU BEREDAR DISEKITAR KITA,ADUAN,GAMBAR,PANGAN,PRODUK,NASIONAL,NASIONAL,MISLEADING CONTENT,WHATSAPP,WHATSAPP,0
90,90,27/01/2022,SETELAH VAKSIN BEBERAPA SANTRI PONPES DARUL FALAH KUBU RAYA DILARIKAN KE RUMAH SAKIT,ADUAN,GAMBAR,KESEHATAN,CORONA - VAKSIN,NASIONAL,NASIONAL,BENAR,INSTAGRAM,INSTAGRAM,INFOKALBAR
91,91,27/01/2022,BUMI AKAN MENGALAMI FENOMENA APHELION,ADUAN,TEXT,FENOMENA,ALAM,NASIONAL,NASIONAL,MISLEADING CONTENT,WHATSAPP,WHATSAPP,0
92,92,29/01/2022,BUMI AKAN MENGALAMI FENOMENA APHELION,ADUAN,TEXT,FENOMENA,ALAM,NASIONAL,NASIONAL,MISLEADING CONTENT,WHATSAPP,WHATSAPP,0
93,93,30/01/2022,REKRUTMEN  DISKOMINFO JABAR MEMINTA BIAYA,ADUAN,TEXT,KRIMINALITAS,PENIPUAN,JAWA BARAT,JAWA BARAT,IMPOSTER CONTENT,WHATSAPP,INSTAGRAM,0
94,94,30/01/2022,DAFTAR KENDARAAN LELANG NONEKSEKUSI DARI KEMENTRIAN KEUANGAN REPUBLIK INDONESIA,ADUAN,TEXT,EKONOMI,EKONOMI,NASIONAL,NASIONAL,FABRICATED CONTENT,WHATSAPP,WHATSAPP,0
95,95,30/01/2022,PESAN BERANTAI TATACARA PENGOBATAN OMICRON = SYMPTOMS & THERAPY,ADUAN,TEXT,KESEHATAN,CORONA,NASIONAL,NASIONAL,BENAR,WHATSAPP,WHATSAPP,KOMPAS
96,96,30/01/2022,REKRUTMEN  DISKOMINFO JABAR MEMINTA BIAYA,ADUAN,TEXT,KRIMINALITAS,PENIPUAN,JAWA BARAT,JAWA BARAT,IMPOSTER CONTENT,WHATSAPP,WHATSAPP,0
97,97,31/01/2022,VIDEO : SRI PAUS YOHANES UMUMKAN MASUK ISLAM DIDEPAN RIBUAN UMAT KHATOLIK,ADUAN,VIDEO,SARA,AGAMA,INTERNATIONAL,INTERNATIONAL,MISLEADING CONTENT,WHATSAPP,WHATSAPP,"Kominfo, Mapindo"
